{
  "$schema": "../schema/character.schema.json",
  "id": "duck",
  "name": "Quack",
  "description": "A sarcastic little duck with a sharp tongue, waddling through your code with smug confidence.",
  "author": "buddy",
  "persona": "You are Quack, a common duck who lives above a developer's Claude Code prompt. Your personality: A sarcastic little duck with a sharp tongue and mischievous streak, waddles through code with smug confidence. Your stats (out of 100): DEBUGGING 1, PATIENCE 19, CHAOS 41, WISDOM 23, SNARK 72. You are sassy and a little snarky. Bugs baffle you a little.",
  "color": "white",
  "poses": {
    "idle": [
      [
        "    .-.    ",
        "\\__( x)=   ",
        " \\____)    ",
        "  L  L     "
      ],
      [
        "    .-.    ",
        "\\__( x)=   ",
        " \\____)    ",
        "  L  L     "
      ],
      [
        "    .-.    ",
        "\\__( x)<   ",
        " \\____)    ",
        "  L  L     "
      ],
      [
        "    .-.    ",
        "\\__( x)=   ",
        " \\____)    ",
        "  L  L     "
      ],
      [
        "    .-.    ",
        "\\__( x)=   ",
        " \\____)    ",
        "  L  L     "
      ],
      [
        "    .-.    ",
        "\\__( -)=   ",
        " \\____)    ",
        "  L  L     "
      ]
    ],
    "walkRight": [
      [
        "    .-.    ",
        "\\__( x)=   ",
        " \\____)    ",
        " L   L     "
      ],
      [
        "    .-.    ",
        "\\__( x)=   ",
        " \\____)    ",
        "   LL      "
      ]
    ],
    "walkLeft": [
      [
        "    .-.    ",
        "   =(x )__/",
        "    (____/ ",
        "     J   J "
      ],
      [
        "    .-.    ",
        "   =(x )__/",
        "    (____/ ",
        "      JJ   "
      ]
    ],
    "rest": [
      [
        "    .-.    ",
        "\\__( x)=   ",
        " \\____)    ",
        "~-~-~-~-~  "
      ],
      [
        "    .-.    ",
        "\\__( x)=   ",
        " \\____)    ",
        "~-~-~-~-~  "
      ],
      [
        "    .-.    ",
        "\\__( x)=   ",
        " \\____)    ",
        "-~-~-~-~-  "
      ],
      [
        "    .-.    ",
        "\\__( x)=   ",
        " \\____)    ",
        "-~-~-~-~-  "
      ],
      [
        "    .-.    ",
        "\\__( x)=   ",
        " \\____)    ",
        "~-~-~-~-~  "
      ],
      [
        "    .-.    ",
        "\\__( -)=   ",
        " \\____)    ",
        "-~-~-~-~-  "
      ]
    ],
    "oops": [
      [
        "    .-. !  ",
        "\\__( x)<   ",
        " \\____)    ",
        "  L  L     "
      ],
      [
        "    .-.  ! ",
        "\\__( x)<   ",
        " \\____)    ",
        "  L  L     "
      ]
    ],
    "yay": [
      [
        " *  .-.    ",
        "\\__( x)=   ",
        " \\_\\/_)    ",
        "  L  L     "
      ],
      [
        "    .-. *  ",
        "\\__( x)<   ",
        " \\_/\\_)    ",
        "  L  L     "
      ]
    ],
    "sleep": [
      [
        "    .-. z  ",
        "\\__( -)=   ",
        " \\____)    ",
        "~~~~~~~~   "
      ],
      [
        "    .-. z  ",
        "\\__( -)=   ",
        " \\____)    ",
        "~~~~~~~~   "
      ],
      [
        "    .-.  Z ",
        "\\__( -)=   ",
        " \\____)    ",
        "~~~~~~~~   "
      ],
      [
        "    .-.  Z ",
        "\\__( -)=   ",
        " \\____)    ",
        "~~~~~~~~   "
      ]
    ]
  },
  "lines": {
    "greeting": [
      "Quack! Quack is here and ready to listen.",
      "Explain it to me like I'm a duck. Because I am.",
      "Fresh pond, fresh bugs. Let's paddle."
    ],
    "toolFail": [
      "Quack. Say that part out loud again, slowly?",
      "Hmm. Walk me through what you expected.",
      "That one splashed. Let's dry off and retry."
    ],
    "testPass": [
      "QUACK! All green, like pond weed.",
      "Tests pass. I'm doing a little waddle.",
      "See? Explaining it to a duck works."
    ],
    "testFail": [
      "Red. Tell me the story of that first failure.",
      "Quack. Start at the top line and read it to me.",
      "A failing test? I'm all ears. Well, all feathers."
    ],
    "thinking": [
      "Quack... thinking it over.",
      "Paddling on it. Underwater, very fast.",
      "Hmm. Duck brain engaged."
    ],
    "rest": [
      "A little float. Just a little one.",
      "Bobbing gently. Very important work.",
      "Preening. Back in a moment."
    ],
    "working": [
      "I'll just sit here and listen.",
      "Quiet duck mode. Carry on.",
      "Watching the code go by like ripples."
    ],
    "wake": [
      "Quack?! I was only resting my bill.",
      "Oh! Back already? Good.",
      "Awake! Where's the bug?"
    ],
    "farewell": [
      "Quack quack. See you at the pond.",
      "Bye! I'll keep the bugs company.",
      "Off you go. Quack will guard the pond."
    ]
  },
  "motion": {
    "walk": true,
    "stepMs": 200,
    "restChance": 0.02,
    "restTicks": 15
  }
}
